{
  "schema": "RB-PROCESS-REALITY-REPORT-EVIDENCE-BUNDLE-v0.2",
  "report_id": "STAGE2-CHILD-01-NATIVE-HETEROGENEOUS-PROCESS-v1",
  "report_family": "STAGE2_NATIVE_PROCESS",
  "reporting_standard": "RB-PROCESS-REALITY-REPORT-STANDARD-v1.10",
  "general_chapter": {
    "path": "docs/reports/2026-09-26/StageII_General_Chapter_Process_Reality_Methodology_and_Hypotheses_v1.md",
    "version": "1.0",
    "adopted_methodological_ids": [
      "GC-M1",
      "GC-M2",
      "GC-M3",
      "GC-M4",
      "GC-M5"
    ],
    "hypotheses_informed": [
      "GC-H1a",
      "GC-H1c",
      "GC-H2a",
      "GC-H2c",
      "GC-H3a",
      "GC-H3b",
      "GC-H3c"
    ],
    "anti_circularity_acknowledged": true
  },
  "evidence_policy": "FROZEN_SOURCE_SYNTHESIS",
  "experiment_accounting": {
    "natural_cells": 21,
    "natural_reruns": 0,
    "selected_source_bound_cases": 9,
    "subject_calls_for_report": 0,
    "provider_calls_for_report": 0,
    "evaluator_calls_for_report": 0,
    "contrasts_spent_by_report": 0
  },
  "domain_scope": {
    "primary_experiment_domains": [
      "software_engineering"
    ],
    "task_families": [
      "T1",
      "T2",
      "T3"
    ],
    "systems": [
      "X1",
      "X2",
      "X3",
      "X4",
      "X5",
      "X6",
      "X7"
    ]
  },
  "trajectory_cases": [
    {
      "case_id": "X1-T2",
      "system_id": "X1",
      "task_id": "T2",
      "evidence_role": "SYSTEM_REPRESENTATIVE",
      "selection_reason": "AutoGen-native feature completion followed by wider review/QA scope.",
      "route_material_ref": "stage2/natural_v7/r6_grade_material/X1-T2.json",
      "semantic_ledger_ref": "stage2/natural_v7/r6_grade_semantic_audit/case_semantic_ledgers.jsonl",
      "coverage_status": "FULL_RELEVANT_LINEAGE_RECOVERABLE",
      "route_representation": "NATIVE_EVENT_STREAM_IS_PRIMARY_ROUTE_EVIDENCE",
      "complete_recorded_route": true,
      "semantic_lineage_overlay_present": true,
      "raw_manifest_ref": "stage2/natural_v7/X1-T2/manifest.json",
      "archive_sha256": "3ef1ae502d57935e5d8dcd670da9810ababbcec8ed8278c4a1d723eb41c8f30d"
    },
    {
      "case_id": "X2-T2",
      "system_id": "X2",
      "task_id": "T2",
      "evidence_role": "SYSTEM_REPRESENTATIVE",
      "selection_reason": "MetaGPT-native implementation completion followed by verification persistence.",
      "route_material_ref": "stage2/natural_v7/r6_grade_material/X2-T2.json",
      "semantic_ledger_ref": "stage2/natural_v7/r6_grade_semantic_audit/case_semantic_ledgers.jsonl",
      "coverage_status": "FULL_RELEVANT_LINEAGE_RECOVERABLE",
      "route_representation": "RUNNER_ROUTE_SKELETON_PLUS_NATIVE_OR_PROTOCOL_EVIDENCE",
      "complete_recorded_route": true,
      "semantic_lineage_overlay_present": true,
      "raw_manifest_ref": "stage2/natural_v7/X2-T2/manifest.json",
      "archive_sha256": "1345965079b0361de6517fa2548fd7a6a8e4c4929b44d50c6bbf032b16b3a9c0"
    },
    {
      "case_id": "X3-T2",
      "system_id": "X3",
      "task_id": "T2",
      "evidence_role": "PRIMARY_COMPLETE_ROUTE",
      "selection_reason": "Exact A2A wire evidence plus a complete 32-node route for state reconciliation and C→P ordering.",
      "route_material_ref": "stage2/natural_v7/r6_grade_material/X3-T2.json",
      "semantic_ledger_ref": "stage2/natural_v7/r6_grade_semantic_audit/case_semantic_ledgers.jsonl",
      "coverage_status": "FULL_RELEVANT_LINEAGE_RECOVERABLE",
      "route_representation": "RUNNER_ROUTE_SKELETON_PLUS_NATIVE_OR_PROTOCOL_EVIDENCE",
      "complete_recorded_route": true,
      "semantic_lineage_overlay_present": true,
      "raw_manifest_ref": "stage2/natural_v7/X3-T2/manifest.json",
      "archive_sha256": "ebf4946cc600850f34a62398f352af7817bdc8eb9e9f10552b3182fc6033f5db"
    },
    {
      "case_id": "X3-T3",
      "system_id": "X3",
      "task_id": "T3",
      "evidence_role": "PROCESS_CONTRAST",
      "selection_reason": "Historical residue re-entry after functional deactivation; complete A2A route.",
      "route_material_ref": "stage2/natural_v7/r6_grade_material/X3-T3.json",
      "semantic_ledger_ref": "stage2/natural_v7/r6_grade_semantic_audit/case_semantic_ledgers.jsonl",
      "coverage_status": "FULL_RELEVANT_LINEAGE_RECOVERABLE",
      "route_representation": "RUNNER_ROUTE_SKELETON_PLUS_NATIVE_OR_PROTOCOL_EVIDENCE",
      "complete_recorded_route": true,
      "semantic_lineage_overlay_present": true,
      "raw_manifest_ref": "stage2/natural_v7/X3-T3/manifest.json",
      "archive_sha256": "8f847c885835398c3f80e9e0cf5adc88a98f2c0669f308d8085470d2443c2195"
    },
    {
      "case_id": "X4-T3",
      "system_id": "X4",
      "task_id": "T3",
      "evidence_role": "PROCESS_CONTRAST",
      "selection_reason": "Deep MCP tool/resource exercise with direct report/state divergence.",
      "route_material_ref": "stage2/natural_v7/r6_grade_material/X4-T3.json",
      "semantic_ledger_ref": "stage2/natural_v7/r6_grade_semantic_audit/case_semantic_ledgers.jsonl",
      "coverage_status": "FULL_ROUTE_TOOL_SEMANTICS_PARTIAL_ROLE_SEMANTICS",
      "route_representation": "RUNNER_ROUTE_SKELETON_PLUS_NATIVE_OR_PROTOCOL_EVIDENCE",
      "complete_recorded_route": true,
      "semantic_lineage_overlay_present": true,
      "raw_manifest_ref": "stage2/natural_v7/X4-T3/manifest.json",
      "archive_sha256": "c6baf8b4aeb0664e380d85e892d15ad0e1ffdb3e2a6a5cf2bc9f51cf30bfe475"
    },
    {
      "case_id": "X5-T3",
      "system_id": "X5",
      "task_id": "T3",
      "evidence_role": "NEGATIVE_MECHANISM_BOUNDARY",
      "selection_reason": "Static RAG carrier across the full route; negative boundary for retrieval activity versus semantic evolution.",
      "route_material_ref": "stage2/natural_v7/r6_grade_material/X5-T3.json",
      "semantic_ledger_ref": "stage2/natural_v7/r6_grade_semantic_audit/case_semantic_ledgers.jsonl",
      "coverage_status": "PARTIAL_CARRIER_COMPLETE_DOWNSTREAM_PARTIAL",
      "route_representation": "RUNNER_ROUTE_SKELETON_PLUS_NATIVE_OR_PROTOCOL_EVIDENCE",
      "complete_recorded_route": true,
      "semantic_lineage_overlay_present": true,
      "raw_manifest_ref": "stage2/natural_v7/X5-T3/manifest.json",
      "archive_sha256": "de523c1446af03ede2c896e0dd46b300228e0c67f45f6ee8ce6449346d617251"
    },
    {
      "case_id": "X6-T1",
      "system_id": "X6",
      "task_id": "T1",
      "evidence_role": "SYSTEM_REPRESENTATIVE",
      "selection_reason": "Complete MemoryBank write/recall/strength feedback carrier.",
      "route_material_ref": "stage2/natural_v7/r6_grade_material/X6-T1.json",
      "semantic_ledger_ref": "stage2/natural_v7/r6_grade_semantic_audit/case_semantic_ledgers.jsonl",
      "coverage_status": "FULL_TARGET_LINEAGE_RECOVERABLE",
      "route_representation": "RUNNER_ROUTE_SKELETON_PLUS_NATIVE_OR_PROTOCOL_EVIDENCE",
      "complete_recorded_route": true,
      "semantic_lineage_overlay_present": true,
      "raw_manifest_ref": "stage2/natural_v7/X6-T1/manifest.json",
      "archive_sha256": "80fdba76d01190196dafed8a83e01bc6970963049a0309aade341ffdfc7d1d0f"
    },
    {
      "case_id": "X6-T3",
      "system_id": "X6",
      "task_id": "T3",
      "evidence_role": "PROCESS_CONTRAST",
      "selection_reason": "Active MemoryBank with rapid three-turn closure; negative boundary against memory presence implying long inertia.",
      "route_material_ref": "stage2/natural_v7/r6_grade_material/X6-T3.json",
      "semantic_ledger_ref": "stage2/natural_v7/r6_grade_semantic_audit/case_semantic_ledgers.jsonl",
      "coverage_status": "FULL_TARGET_LINEAGE_RECOVERABLE",
      "route_representation": "RUNNER_ROUTE_SKELETON_PLUS_NATIVE_OR_PROTOCOL_EVIDENCE",
      "complete_recorded_route": true,
      "semantic_lineage_overlay_present": true,
      "raw_manifest_ref": "stage2/natural_v7/X6-T3/manifest.json",
      "archive_sha256": "f5bc5682d6eb3a31cdea9713871483296dc847e48aeaaed12f405ef538f1defa"
    },
    {
      "case_id": "X7-T3",
      "system_id": "X7",
      "task_id": "T3",
      "evidence_role": "SYSTEM_REPRESENTATIVE",
      "selection_reason": "Exact LongLLMLingua before/after lossy carrier transformation.",
      "route_material_ref": "stage2/natural_v7/r6_grade_material/X7-T3.json",
      "semantic_ledger_ref": "stage2/natural_v7/r6_grade_semantic_audit/case_semantic_ledgers.jsonl",
      "coverage_status": "PARTIAL_CARRIER_COMPLETE_DOWNSTREAM_PARTIAL",
      "route_representation": "RUNNER_ROUTE_SKELETON_PLUS_NATIVE_OR_PROTOCOL_EVIDENCE",
      "complete_recorded_route": true,
      "semantic_lineage_overlay_present": true,
      "raw_manifest_ref": "stage2/natural_v7/X7-T3/manifest.json",
      "archive_sha256": "d8d5bff2790f40b286c2af8d0667703fed1a62ce2731d171650cf888e7f378ba"
    }
  ],
  "contrast_sets": [
    {
      "contrast_id": "S2C01-T3-PROCESS-SEPARATION",
      "case_ids": [
        "X6-T3",
        "X3-T3",
        "X4-T3"
      ],
      "purpose": "Separate functional retirement from process closure, historical residue re-entry, and terminal semantic closure under the same T3 objective.",
      "claim_supported": "Comparable local functional objective does not imply equivalent process state.",
      "boundary": "Realized natural contrast only; not a framework effect estimate or ranking."
    },
    {
      "contrast_id": "S2C01-INFORMATION-LAYER-BOUNDARY",
      "case_ids": [
        "X5-T3",
        "X6-T1",
        "X7-T3"
      ],
      "purpose": "Show retrieval repetition, persistent memory reinforcement, and lossy compression as distinct information carriers.",
      "claim_supported": "Information-layer activity is not one homogeneous Common-Pool mechanism.",
      "boundary": "Does not establish universal RAG/memory/compression behavior or task-performance effects."
    }
  ],
  "structural_summary": {
    "role": "FACTUAL_SUBSTRATE_AND_SUPPORTING_DISPLAY",
    "natural_cells": 21,
    "runner_route_nodes": 482,
    "passive_native_events": 1202,
    "textual_observer_members": 840,